{"schema_version":"astrowoof.initial_authoring_wave_result.v1","wave_id":"wave_33f8a338470960bb887e4aa6","wave_sha256":"33f8a338470960bb887e4aa6ad1115cfbf9d2e4d6383ccecf86c5b5731567d7a","outcome":"ambiguous_submission","member_outcomes":[{"action_id":"paid_000000000000000000000001","pass_id":"kevin_1","outcome":"provider_bound","provider":{"kind":"response","id":"resp_fixture_1"},"provider_create_metadata":{"status":"in_progress"},"reason":null},{"action_id":"paid_000000000000000000000002","pass_id":"kevin_2","outcome":"ambiguous_submission","provider":null,"provider_create_metadata":null,"reason":"provider acceptance unknown"},{"action_id":"paid_000000000000000000000003","pass_id":"kevin_3","outcome":"authorized_unstarted","provider":null,"provider_create_metadata":null,"reason":"create was not attempted"},{"action_id":"paid_000000000000000000000004","pass_id":"kevin_4","outcome":"authorized_unstarted","provider":null,"provider_create_metadata":null,"reason":"create was not attempted"},{"action_id":"paid_000000000000000000000005","pass_id":"kevin_5","outcome":"authorized_unstarted","provider":null,"provider_create_metadata":null,"reason":"create was not attempted"},{"action_id":"paid_000000000000000000000006","pass_id":"kevin_6","outcome":"authorized_unstarted","provider":null,"provider_create_metadata":null,"reason":"create was not attempted"}],"local_continuation_required":true,"provider_custody_action_ids":["paid_000000000000000000000001"],"ambiguous_action_ids":["paid_000000000000000000000002"],"provider_io_elapsed_seconds":0.75}
